12703,3,0,3,0,1,Life aint shit but bitches an money i pass that weed like i studied
12704,6,0,6,0,1,Life aint shit but bitches and money
12705,3,0,3,0,1,Life be my bitch and that hoe move when I say so 128175; http://t.co/ezO2QUqVhu
12706,3,0,2,1,1,Life comes at you fast  @INDXGO_: Guys today I found out that I'm a side hoe 128533;128529;128530;
12707,3,0,3,0,1,Life is a bitch but I appreciate her
12708,3,0,3,0,1,Life is a bitch but every dog has its day
12709,3,0,3,0,1,Life is a bitch, but every dog has its day
12710,3,0,3,0,1,Life is a bitch.... but I appreciate her mayne.
12711,3,0,3,0,1,Life is only unfair if you're a cunt
125,3,0,0,3,2,@FunnyPicsDepot: this the I play soccer, cheat on girls, and wear khaki coloured cargoshaircut http://t.co/ZUai7qWBIR128514; yup
1268,3,0,0,3,2,8220;@El_Grillo1: Islamic State suspects in Indonesia are Chinese Uighurs http://t.co/58IDicaHzT8221;
Uighur Jihadis: they're not just a PRC tool.
12712,3,0,3,0,1,Life is too fuckin sho for free bird
12713,3,0,3,0,1,Life would be so much doper if you could order pussy like you do pizza
12714,3,0,3,0,1,Life's a bitch &amp; then you die
12715,3,0,2,1,1,Life's a bitch then you die- Tony
12716,3,0,3,0,1,Lifes a bitch and then ya die, thats why we get high
12717,3,0,3,0,1,Light skin girls is the biggest hoes?
12718,3,0,3,0,1,Light skin niccas always wanna try to be Ike Turner! Lol  @LuckyLucci5: @VonshayeB only if u can take one back128514;128514;128514;
12719,3,1,2,0,1,Light skin niggah 128514;
12720,3,0,3,0,1,Lighting my pretty ass up w them yellow stars lls
12721,3,0,3,0,1,Lightskins and Spanish girls be acting like breaking niggas heas is a necessity. Stop being cruel bitch
1269,3,0,3,0,1,8220;@Emoney25_: @West305 @_ImJustDede Ima whoop this boy!8221; It's nothing you bean head ass bitch
12722,3,0,3,0,1,Lightskins be like  @TheOnlyCorae: Y'all got me fuck up I'm dicking down them young #PV18 bitches for there refund check I got to pay rent
12723,3,1,2,0,1,Like #Buddha gives a SHIT about #Obama or some other fuckin' NAZI FUCK #socialist #retard with a fuckin' #iphone. DONT MAKE ME LAUGH&gt;
12724,3,0,3,0,1,Like , hoes ain't gone be satisfied until some more bodies come up missing in Hattiesburg .. Let me be the FIRST to tell you!!!
12725,3,0,1,2,2,Like Baathists before them, #ISIS &amp; Al Qaeda suppoers' rivalry is as absurd as their cause - battling for who's the more authentic Jihadi
12726,3,0,3,0,1,Like HELLO my feet were clearly on the back of the desk bitch!
12727,3,1,2,0,1,Like I can't have niggas thinkin ho-tep talk time is apa of my pay sets.
12728,3,0,3,0,1,Like I said... fuck a LeBron. His fan base, bandwagons, dick riders, &amp; loyal ass eaters. I don't like bitch niggas &amp; those that love one.
12729,3,0,3,0,1,Like Nike bitch just do it!
12730,3,0,3,0,1,Like a skinny model boney bitch
12731,3,0,3,0,1,Like a woman to tell you what she wants you to do without sounding like a bossy demanding bitch.The a to that is sexy.
1270,3,0,2,1,1,8220;@Erikaj00: 8220;@Hazel_Dot_Com: Hell naw.  @Dexluger: I wanna see this! http://t.co/u1dqv3EEV38221; yes! Lol8221;trash as hell
12732,3,0,3,0,1,Like bad kids bitch we reckless.
12733,3,0,3,0,1,Like bitch 128171;
12734,3,0,3,0,1,Like bitch that aint even attractive Smh
12735,3,0,3,0,1,Like bitch y u ain't do that in the first place?
12736,6,0,6,0,1,Like bitch you're a man. That means You don't show fear or pain. You be strong when others can't.
12737,3,0,3,0,1,Like damn hoe I gave you a chance when you was average, Why you aint beauty make over when we was together.
12738,3,0,3,0,1,Like don't play with me bitch
12739,3,0,3,0,1,Like freaky bitch but I fucks with her
12740,3,0,3,0,1,Like fucc I got into it wit my mama, ajay, the damn lunch lady, duddy, montea lowkey, &amp; some lit raggedy hoe 128514;128557; all in one day
12741,3,0,3,0,1,Like god damn you diy bitch
1271,3,1,2,0,1,8220;@Erikaj00: I saw a girl scratch her private today.. What that mean?8221; Don't fuck her right in the pussy
12742,3,1,2,0,1,Like keke say real niggas got a hea too it just take a real bitch for him to show it
12743,3,0,3,0,1,Like lex so fine she can have all my hoes, imma make my husband by her a Lamborghini
12744,3,0,3,0,1,Like literally after I'm done texting someone when I don't text back I slide the bitch to the left , I'd win that money
12745,3,0,3,0,1,Like my 3rd grade teacher used to say, you either eat pussy, or you are one. what's it gonna be?@JBilinovich @JZolly23
12746,3,0,3,0,1,Like my momma said don't waste yo time on plzing des fake ass bitches and bum ass dudes cause they ain't gone get u nowhere but pregnant and
12747,3,0,2,1,1,Like my twat
12748,3,0,3,0,1,Like out of no where you've become an inconsiderate bitch and I'm BEYOND done with your shitty attitude #backup
12749,3,0,3,0,1,Like real shit dude da closest nicca I done seen to AI
12750,3,1,2,0,1,Like she got a death touch?  @Tenebris_cor: This bitch standing in front of me looking like rogue from the xmen
12751,3,1,2,0,1,Like some nigga lie to bitches &amp; wonder why they go crazy ... That ain't me
1272,3,0,2,1,1,8220;@Erikaj00: Killin in tekken 6 128526;8221; lies you trash
12752,3,0,3,0,1,Like stop being a bitch for 3.2 seconds.
12753,3,0,3,0,1,Like that bitch Ernest or somebody
12754,3,0,3,0,1,Like the hoes when they lay w/ me.. Puppy eyes when I go, Sayin stay wit me
12755,3,1,2,0,1,Like the song French, got all the black bitches mad because my main bitch strawberryLololol
12756,3,0,3,0,1,Like these nigguhs pussy there's no other thesis
12757,3,0,3,0,1,Likka downtown bitch at a secondline!  @BallHawk_Caer: Man yeah that's ball game Teddy Bridgewater gettin in , we hit 0-3
12758,3,1,2,0,1,Lil 16 y/o in trouble for beatin a bitch showing the judge zero respect. Lol brooklyn niggas and they temper
12759,3,0,1,2,2,Lil Kim really made herself trash smh 128148;
12760,3,0,3,0,1,Lil Wayne has fucked every bad bitch in the game
12761,6,1,5,0,1,Lil bitch
1273,3,0,3,0,1,8220;@FRATernize: I want to be obsessed with someone and I want someone to be obsessed with me8221;then u might have to kill the bitch128563;
12762,3,0,3,0,1,Lil bitch ass
12763,3,0,3,0,1,Lil bitch but her ass move 128541;128540;128540;128540;
12764,3,0,3,0,1,Lil bitch coulda let me go, I was right by my house !
12765,3,0,3,0,1,Lil bitch dumb128514;128514;128514;
12766,6,0,5,1,1,Lil bitch with enough ass &amp;&amp; a future 128525;128536;
12767,3,0,3,0,1,Lil cuz need to help a bitch out
12768,3,0,3,0,1,Lil dumb ass bitch I ain't fucking with you
12769,3,0,3,0,1,Lil hoe tweets on point
12770,3,0,3,0,1,Lil riri sittin pretty while u bitches layin petty
12771,3,0,3,0,1,Lil seaside hoes walkin to our side... For whaaat128514;
1274,3,0,3,0,1,8220;@FREDOSANTANA300: Up making plays8221; can I have my slut bitch girlfriend u always rap about back yet?
12772,3,0,0,3,2,Lilly just tried to climb up a tree after a bird and completely failed oh my god 128514;
12773,3,0,3,0,1,Lima fears change but yet wants to bitch about how much it sucks 128529;
12774,3,0,3,0,1,Listen to her @____Aaliyah____: She curving you on the low @iDntWearCondoms: What it mean if a girl thinks u have the hoes but u don't???
12775,3,0,3,0,1,Listening to the Latina women talk about their baby daddy's andbeating bitches assesmakes being in the sub at 9am woh it...a little bit
12776,3,0,3,0,1,Listing to my dumb ass mom &amp; just getting my eyebrows done at a new place the bitch fucced them up &amp; I have picture day tomorrow 128529;
12777,3,2,1,0,0,Literally every man in my fam copped a bad white bitch as a wife. I ain't even boutta break da chain. Unless a latina comes around
12778,3,0,0,3,2,Literally in the middle of the ghetto and these people look scary
12779,3,0,3,0,1,Literally just got shit on by a seagull..... You're gonna fuckin die bird
12780,3,0,0,3,2,Literally just got up and the first thing I did was chug a huge glass of water
12781,3,0,3,0,1,Literally was in the best mood and bitches literally killed my vibe
1275,3,0,3,0,1,8220;@FabianMleal: I'm fucking tired. Ending the night with some rips127809;128293;8221; so much for hitting me up bitch
12782,3,0,3,0,1,Litterally can't wait for this weekend with my bad bitches 128527;
12783,3,0,3,0,1,Little bitch!!
12784,3,0,0,3,2,Little bitty bumble bee128029;128029; #bumblebee http://t.co/WgYL5UpjQq
12785,3,2,1,0,0,Little fucking gook who smells like shit. An than thinking they're the motherfuckin boss. THE FUCK!
12786,3,0,1,2,2,Little things can just kill a negros mood man
12787,3,0,1,2,2,Live birds found in Elmo doll at US-Mexico border (from @AP) http://t.co/JCH9HQVlPl
12788,3,0,3,0,1,Living with my bitches #live @lauren_borrelli @Kathinator6 @jenna_saispas http://t.co/c3vy1xuOHa
12789,3,0,3,0,1,Living with my bitches, hashtag live http://t.co/9jKAYWGeVZ
12790,3,0,2,1,1,Lmao 128075; @FreakyT252: 8220;@VonshayeB: My nicca!  @FreakyT252: 127936;127936;127936;8221; wat fool??
12791,3,0,3,0,1,Lmao 128681;on the play!  @FunnyJulius: getting pussy is so easy when they believe you're Omar Epps's brother or The Steelers Head Coach's son.
1276,3,0,3,0,1,8220;@FliiNextDoor: If yo pussy stank ; u wasn't raised correctly8221;lmao
12792,3,0,3,0,1,Lmao 171;@MickDaddy_ 171;@TylerIAm I mean damn bitch you was almost ready 20 minutes agohttp://t.co/DtQGxJKJv7187;187;
12793,3,0,3,0,1,Lmao I look like some 80s retard today http://t.co/ZGFv8Z3hQc
12794,3,2,1,0,0,Lmao Lebron's expression says it all  8220;@InkMyHoleBody: This nigga is a fuckin faggot https://t.co/GSGhiZMdmW8221;
12795,3,1,2,0,1,Lmao  @80sbaby4life The food ain't gon run from you FAT bitch
12796,3,0,2,1,1,Lmao  @A2daO: Yeah that pussy yours Cee  @YolaC_: Come get some breakfast from Boom!  @CeeRoss: Breakfast PLZ
12797,3,3,0,0,0,Lmao  @Handsomeesco_55 If u live wit ya girl and u do dishes u a faggot
12798,3,0,3,0,1,Lmao  @Luvv_55st So none of you bitches on my tl diy??? #Salad #ExtraDressing
12799,3,0,1,2,2,Lmao  @MoeMain44 The in soles in Reebok Classics can't even handle the diabetic weight Rick Ross holds
12800,3,1,2,0,1,Lmao  @MoeMain44 Yo a cooned out nigger boy
12801,3,0,3,0,1,Lmao  @checkmyaura: 128514; @__malik07: That's all it take ? Ima sta lifting bitches up after the club too
1277,3,0,3,0,1,8220;@FliiNextDoor: Phat pussy 128525;128553;128166;128166;128166;128520;: http://t.co/Cbel8h29e18221;that looks like a scrotum
12802,3,0,0,3,2,Lmao  @iPOSTBADTWEETS: Lowkey Peyton Manning trash
12803,6,0,6,0,1,Lmao bitches is crazy...after reading the first sentence to yaself jus see how dumb you sound... #ASideBitchMadeThis http://t.co/PkvTaScEcV
12804,3,1,2,0,1,Lmao chill spook  @BakeGriffin You think you Better than niggas cause you in Miami you 252;ber colored Faggot @BmoreHumble?
12805,6,0,5,1,1,Lmao drake is on some bullshit with Serena Williams, wallah she looks like a tranny
12806,3,0,3,0,1,Lmao he left that bitch128514;128514;128514;128514;
12807,3,0,3,0,1,Lmao if I catch u in tha field I'm blowin 128299;128168;128299;128168;128299;128168;8220;@Horsepower_Will: @PAPER_CHAYSIN shut yo bitch ass up opp lol8221;
12808,3,2,1,0,0,Lmao let these hoes be hoes ain't no Savin nem
12809,3,0,3,0,1,Lmao look at these hoes  @RareHipHopPic: http://t.co/lOCEXe8Rcd
12810,3,0,1,2,2,Lmao redskins turnin up
12811,3,0,3,0,1,Lmao shoy twitter name is pussy 2 chubby...lmfao im dead
126,3,0,3,0,1,@G27Status: I could go for a fat ass bitch on my lapsame
1278,3,1,2,0,1,8220;@Fly_Air_Walker: Everybody entitled to they own opinion tho.8221; Not that bitch she need to shut up &amp; sit the fuck down
12812,3,0,3,0,1,Lmao that the funniest way to disrespect a person by calling him a itty bitty bitch. Makes me feel low in life
12813,3,1,0,2,2,Lmao the shovel video is pretty awesome, she went down like a ton of bricks lol. Gotta love honky riff raff savages. That is all.
12814,3,0,3,0,1,Lmao they got the Titanfall jump in this bitch
12815,3,0,3,0,1,Lmao this bitch high asf and she asked me Do I look high?
12816,3,0,3,0,1,Lmao this bitch thinks she fancy with some michael kors
12817,3,0,3,0,1,Lmao this bitch.
12818,3,0,3,0,1,Lmao trifling ass bitch!
12819,3,0,3,0,1,Lmao wack ass rappers stay mad, make better music then little bitch.  @FreddieGibbs: @Bjames055 get on the suck my dick list
12820,3,0,3,0,1,Lmao wallah you're nasty bitch
12821,3,1,2,0,1,Lmao!  @CapoToHeaven Lmao  @HeauxmerSimpson: @AtlanticCity you'll never be Vegas. You faggot punk bitch.
1279,3,0,2,1,1,8220;@ForeverrrJadaaa: huge nips scary me8221; they scary me too
12822,3,0,3,0,1,Lmao!  @Chollie_Grapes Is fish pussy wett?
12823,3,0,2,1,1,Lmao!  @HUMonTHESE Harden look like the last air bender out this bitch. http://t.co/jN8exkXf
12824,3,2,1,0,0,Lmao! You niggas regionally picky about hoes now. Just say anything on Twitter. Makes it's fun tho
12825,3,1,2,0,1,Lmao!!  @CarmelIoAnthony: NOBODY cleans a house FASTER than a nigga expecting some pussy.
12826,3,0,3,0,1,Lmao. I still feel played bout this hoe.
12827,3,0,2,1,1,Lmao.... These hoes!
12828,3,0,3,0,1,Lmaoo 8220;@LeanandCuisine: Bad bitch: Can I hit that?

You matching or.....?

Bad bitch: *bats eyelashes*

.........are you matching or?8221;
12829,3,0,3,0,1,Lmaoo I should've seen that coming  @DatBoyRayT: @1AlaaZ fat bitches need love to Craig
12830,3,0,3,0,1,Lmaoo  8220;@PRAYINGFORHEAD: 8220;@_ANGELSAMUELS: @PRAYINGFORHEAD @BAESTATION ur a bitch for not following back 128575;8221; http://t.co/p43U1qUbWk8221;
12831,3,0,3,0,1,Lmaoo  @De_La_David: @JaeTips bruh make a song called uber and the hook can be that uber make that pussy wet
1280,3,0,2,1,1,8220;@FreakyAbandoned: Mental Asylum in Dallas Texas, 1980's. http://t.co/03S8dEsEzq8221; should I go find this hoe?
12832,3,0,3,0,1,Lmaoo  @IMCoolLike_That: Stfu..who are u to prefer what a woman wears on her feet bitch  @80sbaby4life: I hate bitches that wear wedges
12833,6,0,6,0,1,Lmaoo man this bitch thinks she's so intelligent.
12834,3,0,3,0,1,Lmaoo shut up hoe
12835,3,0,3,0,1,Lmaoo tony spanked it maaad times to that bitch voice
12836,3,0,3,0,1,Lmaoo u a downgrade has been jayin ass bitch
12837,3,0,1,2,2,Lmaoo we was sayin this same statement last year  @DeeSwaggyJay93 Boozer is trash bro I'm done!! 128514;
12838,3,2,1,0,0,Lmaooo  @Handsomeesco_55 She a tranny if she can open a jar of pickles by herself
12839,3,0,0,3,2,Lmaooo naw man  @DipOnline Yo want in  @HumbltonBanks: U serious bro?? lol  @CheezMoeJenkinz 2-3:10am early bird special
12840,3,0,3,0,1,Lmaooo nigga said a Hol it downdyke was in the background
12841,3,0,2,1,1,Lmaooo wait so why everybody talm bout card crackers?! I missed it
1281,3,2,1,0,0,8220;@FreddieGibbs: Tea bag a bitch.8221; Pahahaha
12842,3,0,3,0,1,Lmaoooo  @Hand2DaHairline: His sister probably got the pussy that night  @No_Cut_Card: #NeverForget http://t.co/HkXEbFWDYz8221;
12843,3,1,2,0,1,Lmaoooo deep  @haneema: That girl curved every nigga that tried to holla and nobody said fuck you then bitch...#whiteprivilege
12844,3,0,3,0,1,Lmaoooo nah I'm down here turning up  @4TR0N3: Yah not gonna believe this but @ItsNotHarold being a bitch in BG being a bitch 128514;128514;128514;128514;
12845,3,0,0,3,2,Lmaoooo!!!!!!!!!!!! @King_Komo: A bird in the hand is woh two in the bush. http://t.co/50Ye6jAADU
12846,3,0,3,0,1,Lmaoooo @BakeGriffin Remember when y'all bitches were Lotus Flower Bombs around this time last year
12847,3,1,2,0,1,Lmaooooo  @savvgrace: bitches be like 8220;relationship goals8221;8230;. Dumb ass nigga http://t.co/5CuNHFd79O
12848,3,0,3,0,1,Lmaooooo im outta here  @da_1eye_creep Bobby Shmurda looks like a negro league player http://t.co/SngyNAGULC
12849,3,0,3,0,1,Lmaoooooo 171;@PubesOnFleeK: That bitch stripping at a murder scene 8220;@ItsDollyCouture: My view 128525; http://t.co/oiJizl0naF
12850,3,0,1,2,2,Lmaoooooo @ Supreme being trash. Guess Bape is trash to huh?
12851,3,0,3,0,1,Lmaoooooo  @HeauxmerSimpson  @iluvfashion618 Dre really is a big sloppy bitch. He's fat as shit.
1282,3,0,3,0,1,8220;@FreeBlizz_ICBC: If I posted pics of everything I do in my life yall hoes would fall in love !8221;don't kill em Channing
12852,3,0,3,0,1,Lmaoooooo lil Dave you a hoe for that
12853,3,1,2,0,1,Lmaoooooooo  @80sbaby4life: You woke up a faggot didnt you  @Maxin_Betha: My nigga ain't get carded since I was a sophomore b
12854,3,0,3,0,1,Lmaoooooooo  @Chollie_Grapes: Dumped the shyt outta me. Fuck wrong with her. I'm perfect like angel pussy
12855,3,0,3,0,1,Lmaoooooooo!  @HeauxmerSimpson D'Angelo prolly nice as shit at Madden now. Lmao. Fat bitch.
12856,3,0,3,0,1,Lmfao  @GahDamnAnimal: Fat hoes in tight clothes be lookin like a half opened can of biscuits
12857,3,0,3,0,1,Lmfao  @Luvv_55st Eating pussy  @DanaBlack55st: Of what? 128064;  @CreativeBlair: I really want my braces off it's in the way 128553;128553;
12858,3,0,0,3,2,Lmfao  @NYDailyNews: The New York @Yankees have won 27 World Series titles 8211;160;the most of all-time.
12859,3,0,3,0,1,Lmfao  @_TrishaAnn_: I only twerk to Somewhere in Americabecause when Hov says twerk, you twerk bitch!!
12860,3,0,3,0,1,Lmfao all bitches is hoes then
12861,3,0,3,0,1,Lmfao bitch got her shit rocked
1283,3,0,3,0,1,8220;@FriendlyAssh0le: 5'3 200 lbs aint thick bitch, you a fucking wahog8221;128514;
12862,3,0,3,0,1,Lmfao but we don't talk gtfoh 128514;128514; bitch I guessed it! &amp; I was right 128514;128527;
12863,3,0,3,0,1,Lmfao custy bitches be like ( ) come on in
12864,3,0,3,0,1,Lmfao hoe
12865,3,1,2,0,1,Lmfao niggas was going ham on the trash can in class.
12866,3,0,1,2,2,Lmfao no you didnt  @SS4_Fresh: @vivelacouney got cute new avi and all but she too old for colored contacts 128073;128064;128584;
12867,3,0,3,0,1,Lmfao right!.. @kohkohbxtchzz: You knew you was sidechick. Stop hating hoe.
12868,3,0,3,0,1,Lmfao this is some straight up retarded shit up in here
12869,3,1,2,0,1,Lmfao u sloth trinidad james with a relaxer lookin ass bitch@Flowy_Bri: i hate niggers, imma sta talking to white boys.
12870,3,1,2,0,1,Lmfao watching Brokeback Mountain with Taylor cuz we've both never seen it aha #queers @mckinley719
12871,3,0,3,0,1,Lmfao.. oh i forgot.. texting it to u now  @DaRealQuitaM: @VonshayeB I told u to text me what I need to buy for the salad a bitch hungry
1284,3,0,3,0,1,8220;@FriendlyAssh0le: You fat bitches needa stop biting your lips when you take pictures. Y'all look hungry, not sexy.8221;128514;128514;128588;
12872,3,0,3,0,1,Lmfaooo nigga  @SenorSteez: Nigga, yo lips look like a charcoal bitch pussy.
12873,3,0,3,0,1,Lmfaooo this bitch hits my car and calls the cops and says it was my fault 128514;128514;128514; dumb bitch
12874,3,0,3,0,1,Lmfaooo8220;@AdrienBroner: Two bad bitches giving me head at the same dam time...... #oldPICS LOL http://t.co/Y4dXfH8nLv8221;
12875,3,0,3,0,1,Lmfaoooo fizz baby mama snatched that bitch soul
12876,3,0,3,0,1,Lmfaooooo  @miavenise: Can't trust a bitch that don't smile with her teeth.
12877,3,0,3,0,1,Lmfaoooooo  @BryceHamilton11: I'm so glad my shoy ain't all over twitter and IG tryna be a famous Columbus hoe 128514;128514;128514;128514;
12878,6,0,6,0,1,Lmfaoooooo  @TooDopeForLife: LMFAOOOOOOOPOOOOOO  @DJKayyOhh: 8220;here come yo bitch ass auntie8221; http://t.co/e5KlLhp0CV
12879,3,0,3,0,1,Lmfaooooooooo bro  @BrandNewAndrew: Strippers on twitter talking about how much money they made tonight. Like bitch i will rob you
12880,3,0,3,0,1,Load this bitch up with Kool Aid
12881,3,0,3,0,1,Lock 5 fat bitches in 1 room for 5 days with just 5 Mcdoubles. Now that's hunger games
1285,3,0,3,0,1,8220;@FriendlyAssh0le: how bitches be looking the first day of school. http://t.co/OpSkH1xZGb8221;128514;
12882,3,0,1,2,2,Log off nigger  @PoloKingBC: #relationshipgoals http://t.co/Ge9koImYGj
12883,3,0,3,0,1,Lol #Facts @MikeDiggEm: The baddest bitches be porn stars n strippers
12884,3,0,3,0,1,Lol @ active @SherinaVictoria: Idgaf about an active hoe as long as she's not fucking my man. need to learn how to mind your business.
12885,3,0,3,0,1,Lol @ me next time bitch
12886,3,1,2,0,1,Lol Father has bitches pouring arizona tea on themselves in this one video
12888,3,1,2,0,1,Lol I followed the bitch just so I can unfollow her cause she talkin shit, shit away with her two
12889,3,0,3,0,1,Lol I love when ppl think ima fucking look away like a pussy when I catch them staring at me lmao LOOK AWAY HOE
12890,3,0,2,1,1,Lol I make hoes madd hahhaha, @No_FAKINGG. ;)
12891,6,1,4,1,1,Lol I never understood retards who use the atm and pay a $2 fee to get $20 and put it in gas so the don't pay the credit price -_-
12892,3,0,3,0,1,Lol I see what you did there  @JayWiz614: @ItsNotHarold hell yeah bitches hate that shit
1286,3,0,3,0,1,8220;@FukknTyler: @lil_aerii LIGHTSKIN MF LMFAOOO8221; ight white bitch lol 128299;128299;
12893,3,0,3,0,1,Lol I told Kenzie's bf I was going to stop cussing and he lol'd in my face like bitch u don't even know me
12894,3,0,2,1,1,Lol I told my brother imma good christin girl he said nah u a wholesome hoe lmaoo so bogus who says shit like dat he mean af
12895,3,0,3,0,1,Lol It ain't nun wrong wit Tryn to be 1 of da realist niccas n da city tho #salute
12896,3,0,3,0,1,Lol Jk I changed my number on them ho*s
12897,3,0,3,0,1,Lol Lebron a bitch.. Now that basketball is back say goodbye to spos center.. It's Lebron center now..
12898,3,2,1,0,0,Lol Nicca dime game got soo much clout niccas goin to da store to buy sum dice
12899,3,0,3,0,1,Lol  @HURRICANESENSEI: @viaNAWF Just need to know what that pussy like so one time is fine with me
12900,3,2,1,0,0,Lol  @JayFucknHarris: Youuuuu got niggas but I don't got bitches
12901,3,0,3,0,1,Lol  @MsTamarShawnice Most chicks that go to Enon are hoes or reformed hoes
12902,6,0,6,0,1,Lol Sam said Betty Boopis a hoe 128514;
1287,3,0,2,1,1,8220;@FullaCharisma And happy to be hoes too. Smh.8221;better than being in denial
12903,3,0,3,0,1,Lol actually bitch please choke on my nuts.
12904,3,0,3,0,1,Lol at bitches thinking Kanye is the perfect man because he opened the car door for his wife.. You bitches don't know wtf y'all need..
12905,3,0,3,0,1,Lol at the random fist fightaka pussy shove match at DnD tonight.
12906,3,1,2,0,1,Lol at these honkies talking trash I'm done with this shit #growup #whitetrash
12907,3,0,3,0,1,Lol at this bitch ass boy telling me how to respond to peer pressurefor values of peer pressurethat equal being called a groupie
12908,6,0,6,0,1,Lol bitch
12909,3,1,2,0,1,Lol bitch u a has been
12910,3,0,3,0,1,Lol bitch you think you're classy? THE FUCK EVER
12911,3,0,3,0,1,Lol bitches be hella mad about they exs like why can't you be friends and forget about the past
12912,3,0,0,3,2,Lol colored contacts played out.
127,3,0,3,0,1,@GEDMelle: 17 missed calls!!!! 128544;128545;Das yo P.O bitch twitter finna be screamn #FreeMoneyMelle
1288,3,2,1,0,0,8220;@FunnyPicsDepot: fucking white peoplehttp://t.co/uyjGzuX4Cc8221; bitch wut?
12913,3,0,3,0,1,Lol dat bitch petty
12914,3,0,3,0,1,Lol faggot team pipe beef
12915,3,0,3,0,1,Lol hell naw fuck dat one swing all swing bitch one gone get punch then the rest gone get punched tf out lmao
12916,3,0,0,3,2,Lol ike Turner http://t.co/8yNqYYaOjo
12917,3,0,3,0,1,Lol im out here curving bitches like im taken
12918,3,0,3,0,1,Lol it's 4:36 and bitches are out here staggering drunk
12919,3,0,3,0,1,Lol lawwwddd that's why I aint fuck with jitt I never wanna be labeled a hoe
12920,3,0,3,0,1,Lol life Made her a hoe
12921,3,0,3,0,1,Lol look @LoveRHateMe_ is Mike Brown's twitter. Look at the trash he wrote about lmao. Gentle Giant my ass #Ferguson
12922,3,1,2,0,1,Lol my brother a fag Mann
1289,3,0,3,0,1,8220;@FunnyPicsDepot: All the seniors young side hoes gonna be at graduation like http://t.co/qFDBBu4hPV8221;
12923,3,1,2,0,1,Lol my brothers just said he a pussy ass niga well in the words of wizdom I second dat lmaoo leave u hu out here
12924,3,0,3,0,1,Lol my porn name is master licker wtf y I gotta have dat bitch ass name
12925,3,0,2,1,1,Lol niccas remember the ginyu force 128514;
12926,3,0,3,0,1,Lol niggas out here saving hoes 128514;128514;
12927,3,0,3,0,1,Lol niggas still be talking about me threw bitches smh
12928,3,1,2,0,1,Lol petty ass  @BreadTruckkBri: Lmmfaooooo @drake a hoe 128514;128514;128514; http://t.co/mStsEEeT4R
12929,6,0,5,1,1,Lol shawty at sheets gave me her number haha I throw tht shit in trash outside
12931,3,0,3,0,1,Lol stop fuckin wit dem birds.  @Drako_713 Fuck y'all hoes all y'all do is lie
12932,3,0,3,0,1,Lol that's some hoe shit
12933,3,0,2,1,1,Lol they tricking niccas left n right
1290,3,1,2,0,1,8220;@FunnyPicsDepot: Realist bitch to ever step foot on a soccer field http://t.co/CSfigYQuT48221; every team has a bitch like this
12934,3,1,2,0,1,Lol this freshman said why dress up as a baby that's so retarded, I said well I mean u act like a baby so might as well dress like one
12935,3,0,3,0,1,Lol this girl makes fun of guys for having like light voices but I'm just like bitch your voice is like deeper than five men together wtf
12936,3,0,3,0,1,Lol u mad motherfuckin hoe
12937,3,1,2,0,1,Lol when a nigga say he miss u say don't miss me miss ya bitch lmao
12938,3,3,0,0,0,Lol you're a cunt liar and I hope you drop dead k :-)
12939,3,0,3,0,1,Lol!! 8220;@ItzSweetz_Bitch: Ooop! QT @TiFFANY_P0RSCHE: You little twats.8221;
12940,3,2,1,0,0,Lol, so since I'm from the south I automatically sound like a fucking redneck. Hahahaha how about fuck you, stupid ass.
12941,6,0,6,0,1,Lol, what I look like waiting on another nigga bitch.128514;128514;128514;
12942,3,0,3,0,1,Lol. Nice crutch hoe.
12943,3,0,0,3,2,Lol.. shut up!  @ABrown252: @VonshayeB lmao early bird gets the worm
1291,3,0,3,0,1,8220;@FunnyPicsDepot: When the nigga with the aux cord playin some trash shit http://t.co/LMP5BeplVy8221; @JWilko7
12944,3,0,2,1,1,Lololol joey lattimes phone just called him retarded
12945,3,0,3,0,1,Lolololol not to be a hoe but that was a nyyce one
12946,3,0,3,0,1,Long hair = pussy any time you want it
12947,3,0,3,0,1,Long neck ass bitch lmbo
12948,6,0,0,6,2,Long yellow.
12949,3,0,3,0,1,Longway bitch
12950,3,0,3,0,1,Look A Y'all Makeup bitches , Lookin like a ghost when ya wake up bitches
