11494,3,0,3,0,1,I'm a couple bitches header 128526; ioeno em 128514;128514;
11495,3,0,3,0,1,I'm a dick and you ain't even got ya strap on, pussy
11496,3,0,3,0,1,I'm a dope ass nigga n these bitches OD
1146,3,0,3,0,1,8220;@BINDLE13: My momma aint raise no hoe8221;
11497,3,0,3,0,1,I'm a hoe for that 128557;128557;128557;128557;128557;128514;128514;128514;128514;128514;
11498,6,0,6,0,1,I'm a lady bitch
11499,3,0,3,0,1,I'm a light skin niggah 128588;
11500,3,0,3,0,1,I'm a made man, y'all pussy niggas in the middle.
11501,3,0,3,0,1,I'm a pull up, eat on that pussy, and dip
11502,3,0,3,0,1,I'm a purple headed cunt
11503,3,1,0,2,2,I'm a redneck, but without the homophobia and racism
11504,3,0,3,0,1,I'm a stretch that pussy out
11505,3,0,0,3,2,I'm a sucker for colored eyes 128532;128532;
11506,3,0,3,0,1,I'm a twat
1147,3,0,3,0,1,8220;@BSBHForum: #BeatTheHabs #NYR http://t.co/okvhWHy3Vh8221; @CanadiensMTL #pussy
11507,3,0,2,1,1,I'm a wigger
11508,3,0,3,0,1,I'm about to get this bitch a cell mate
11509,3,0,3,0,1,I'm about to hit a bitch
11510,3,0,3,0,1,I'm about to jog higher this stupid bitch ass hoe @mf saab1@t_jawad89 @
11511,3,0,0,3,2,I'm about to post my Charlie Clips vs Yung ill rap battle review in a few
11512,3,0,3,0,1,I'm about to push this niggah off my seat trying to squish me and shit
11513,3,0,3,0,1,I'm about to spray perfume on your bitch because if I have to look at trash,it might as well smell decent 9995;
11514,3,0,3,0,1,I'm about to sta a bad bitch mentoring association bc GIRL YOURE A BAD BITCH DONT LET ANYBODY TELL YA OTHER WISE
11515,3,1,2,0,1,I'm about to sta calling out people and why they do retarded things
11516,3,0,3,0,1,I'm addicted to IG, Twitter just my side bitch
1148,3,0,3,0,1,8220;@B_Davis0529: SMDH Eagles fans. You a bitch!  @MikeMiss975: Hey Giants fans: Victor Cruz is over. Dance to that.8221; Hey watch it
11517,3,2,1,0,0,I'm already tired and mr stupid af decides to show us a video on trigonometric notions so um yeah I just wanted to say you're a hoe
11518,3,0,3,0,1,I'm always dumb too a extra slow ass bitch 128574;128530;128514;128584;128553;128175;128074;
11519,3,0,1,2,2,I'm an 18 year old gay driving through the back roads of redneck Virginia blasting Cheetah Girls. If that doesn't scream sitcom, what does?
11520,3,0,3,0,1,I'm asking this boy questions like he my bitch
11521,3,0,3,0,1,I'm at home throwing up taking care of my kid. Yet I'm a hoe? Oh. Oh okay.
11522,3,0,3,0,1,I'm back bitch
11523,3,0,3,0,1,I'm back bitches 128513;128513;128513;128513;
11524,3,0,3,0,1,I'm back bitches 3d back in effect it's on tonite http://t.co/dpYLQzG1
11525,3,0,3,0,1,I'm beating bitch jay jay ass when I see this nigga . I really ova here dead tho 128557;128514;128128;128514;128079;
11526,3,0,3,0,1,I'm beginning to thincc my brother is defiantly into fat Mexican bitches....? Eugh 128534;
1149,3,0,3,0,1,8220;@BaabyD_: cause i look great bitch, fuck you mean?128557;128514;128514;8221;
11527,3,0,3,0,1,I'm bout to be.back on my old shit I miss my hoes texting me saying they wanna come see me
11528,3,0,3,0,1,I'm bout to delete you thirsty hoes, all over the same twitter nigga that's a nobody yall look sooo wack
11529,3,0,3,0,1,I'm bout to get this bitch a cell mate
11530,3,0,3,0,1,I'm bout to hop off this hoe they Tryna get on my ass
11531,3,0,3,0,1,I'm bout to sta singing and shit lol hoes going crazy or this nigga August
11532,3,1,2,0,1,I'm boutta deck this bitch in the face .
11533,3,1,2,0,1,I'm boutta merk a nigguh
11534,3,0,3,0,1,I'm bringing booty back. Go ahead and tell them skinny bitches that.
11535,3,0,3,0,1,I'm busy what I'm tell all hoes who played me to the side .... I'M BUSY
11536,3,0,3,0,1,I'm cold as a bitch and don't even need a fleece, and if she a bad bitch tell her drop to yo knees.
1150,3,0,3,0,1,8220;@Badazz_jspates: I'm suppose to eat yo booty bitch wym8221; 128557;128557;128557;
11537,3,0,2,1,1,I'm coming for that no 1 spot nigguh @Nichollsodeon
11538,3,1,2,0,1,I'm crazy poke out your eyes, slit yo clit, you give a shit cuz I'm the shit
11539,3,0,3,0,1,I'm cute with or without the makeup &amp; eyelashes 128076;128524; y'all bitches depend on that shit
11540,6,2,4,0,1,I'm dat nigga that these hoes just can't stand... 127926; B.G
11541,3,0,1,2,2,I'm definitely watching that mook/ lux battle today damn it!!!
11542,3,0,3,0,1,I'm done crying. I'm done being worried! Ain't no bitch in me, or is stupid written over me
11543,3,1,2,0,1,I'm done wit this cheer team all these bitches are Literally BRAIN DEAD.
11544,3,1,2,0,1,I'm dracula bitch, don't got a problem smackin a bitch
Kidnap em, attack em with axes n shit
11545,3,0,3,0,1,I'm dressing up as an albino one day and scaring the shit out of amaris' mom
11546,3,0,3,0,1,I'm drunk eat a fucking twat
1151,3,0,3,0,1,8220;@Banqq_Jayy: @1Jayee: 8220;@ItsKeeJay: I can't remember all the girls I've smashed 128563;128584;8221; On God.128588;hoe shit8221; Not technically, it takes 9996;65039;.
11547,3,0,3,0,1,I'm dry humping hoes tonite bussin on they costume so they man deal wit em later.  @Me_RonG: Somebody girl gettin fucked tonight
11548,3,0,3,0,1,I'm fasho in that hoe then!  @BJayBlast: TBRetreat is about to be 21+? I'm in that hoe for real this time!
11549,3,0,2,1,1,I'm fine af in that hoe
11550,3,0,3,0,1,I'm finna quit this bitch irratating me frfr I'm sick of this shit let me sta job huntin now
11551,3,0,0,3,2,I'm finna see the Yankees win a baseball game
11552,6,0,6,0,1,I'm finna sta slapping bitches
11554,3,0,3,0,1,I'm flexin on these bitches all gold bottles no Bombay
11555,6,1,5,0,1,I'm flexing on niggas and they bitches
11556,3,1,2,0,1,I'm flipping thru the tv saw the bachelor on stooped for a second and all I can say is all them hoes garbage
11557,3,0,3,0,1,I'm from #SouthChicago so I know it's bad but...bitch, it ain't like you live in Englewood! #FOH
1152,3,0,2,1,1,8220;@BarryClerjuste: I cried like a bitch after my first breakup. Never loved again lol8221;
11558,3,0,3,0,1,I'm from Long Beach California... so people automatically think I'ma badass, or a bitch.... hahha
11559,3,0,3,0,1,I'm fucking around with two bitches but i never made those hoes my mistress
11560,3,0,1,2,2,I'm getting sleepy and my phone is acting retarded...
11561,3,0,2,1,1,I'm getting spanked in fantasy 128514;128514; he beating my by 100 because of this damn New England game &amp; Julian eldman trash http://t.co/bpptg2pSKF
11562,3,0,3,0,1,I'm getting tired of you telling what the fuck I'm doing every time I'm doing something lol. -peckerwood guy
11563,3,0,3,0,1,I'm glad Ari know to text me or get in contact with me cause I've been calling my bitch all day. I be worried.
11564,3,0,3,0,1,I'm glad that after telling me how much of a basic bitch I am, @GreekPharaoh also admitted to being basic. #truefriendsarebasictogether
11565,3,0,3,0,1,I'm glad to see that broads are still into the faggotlook when it comes to picking dudes.
11566,3,0,3,0,1,I'm glad you hoes ain't my momma
11567,3,0,3,0,1,I'm goin big, bitch, suck my dick
1153,3,0,1,2,2,8220;@BasebaIIVines: Michael Pineda hides pine tar...on his neck http://t.co/PJRKJeaY6h8221; fact that the Yankees cheat 128077;128077;128077; Go Red Sox!! #Boston
11568,3,0,3,0,1,I'm going thru it my bitch ain't even my bitch she let the whole team hit
11569,3,0,3,0,1,I'm going to be an ugly niggah for Halloween so I can just be myself.
11570,3,0,1,2,2,I'm going to dress up as trash for Halloween. Oh wait, I look like that everyday.
11571,3,1,2,0,1,I'm going to punch a bitch if my cleats don't come in128544;
11572,3,2,1,0,0,I'm going to sell my iPhone and both my Macs, I don't suppo faggots.
11573,3,0,3,0,1,I'm going to the movies this weekend, by myself. No BFFL, no bitch, no nigga, just me... #Solo
11574,4,0,1,3,2,I'm gonna be ghetto and color over the stain with a sharpie ctfu
11575,3,0,3,0,1,I'm gonna go ape shit if there is an IF Uchida
11576,3,0,3,0,1,I'm gonna hoe the shit out of you when we meet again can't wait
11577,3,0,3,0,1,I'm gonna kill bitches today.
1154,3,0,3,0,1,8220;@BasedChasen: Chad Jordan in this bitch8221; I'm crying
11578,3,0,3,0,1,I'm hands on when its time ta murk a bitch
11579,3,0,3,0,1,I'm happily taken tho... &amp; I ain't cheating for none of you hoes.
11580,3,0,3,0,1,I'm happy I ain't that bitch I use to be
11581,3,0,0,3,2,I'm hooked on monkey phonics.
11582,3,0,3,0,1,I'm in Vegas bitches http://t.co/JgPiw1kDer
11584,3,0,0,3,2,I'm in my bed like half asleep and stuff. But I really want that Oreo coffee coolatta.
11585,3,0,3,0,1,I'm in my glory bitch 128130;128315; http://t.co/pnOAaWENkv
11586,3,0,3,0,1,I'm in the cut with my old boys and this bitch asks me to smoke weed with her in a fucking Yaris. The fuck? Lol hell no.
11587,3,0,3,0,1,I'm in the zone like the secondary, no lie bitch I'm flier then a pet canary
11588,3,0,3,0,1,I'm in this bitch 128563;128563;128563;128563; like a mf 128514;128514;128514;128514;9996;65039;127811;128080;128168;
114,3,1,2,0,1,@DionaIrish: I hate a I'm pregnanttype of bitch.
1155,3,0,3,0,1,8220;@BasedChasen: Grandmas always b asking you Do you have a girlfriend???No....I got hoes tf you mean8221; real shit.
11589,3,0,3,0,1,I'm in this hoe tripppped out people be wildin
11590,3,0,0,3,2,I'm jus a trill nicca mane
11591,3,0,3,0,1,I'm just gonna get my dog to eat a bitch
11592,3,0,3,0,1,I'm just living my nig....
11593,3,0,3,0,1,I'm just matching grams wit my fam bitch
11594,3,0,3,0,1,I'm just not going to be a bitch to you because we don't speak for reasons. It was a decision and it's done and over with why sta shit?
11595,3,1,2,0,1,I'm just on this hoe to laugh
11596,3,0,3,0,1,I'm just salty bitch
11597,3,0,3,0,1,I'm just sayin. That's my baby &amp; I already told you bitches.. 128076;
11598,3,0,2,1,1,I'm just saying, in your twitter pic you look like such a guido and i love it #pattyfuckingboges
1156,3,1,2,0,1,8220;@BasedDevJay: bruh i'm telling you if she got 
zebra print bed sheets 9/10 she a hoe8221; @rachel_dority 128514;128514;128514;
11600,3,0,0,3,2,I'm just sitting here waiting for twitter to explode once this Yankees game ends
11601,3,0,0,3,2,I'm just tryna get to sleep before the birds sta getting rowdy.
11602,3,3,0,0,0,I'm just upset they got faggots on this show
11603,3,0,3,0,1,I'm known around Tampa as the ugly kid with no hoes
11604,3,1,2,0,1,I'm lactose and hoe nigga tolerant
11605,3,1,2,0,1,I'm late as hell....Niggas really hating cuz these hoes want that lightskin dude in jail y'all crazy
11606,3,0,3,0,1,I'm lifted before I'm stiff out of this bitch
11607,3,0,2,1,1,I'm like Rashad and I did her like when he found out the ghetto truth about New-New
11608,3,0,3,0,1,I'm literally about to scream and throw a bitch fit if people don't hurry the fuck up.
11609,3,2,0,1,0,I'm literally laughing in shock, amazement, joy. In...just everything. In everything! Pop the champagne American queers. We have arrived.
1157,3,0,3,0,1,8220;@BeardedGemini: 8220;@GinaSanabria_: I have no hoes because yah nigga ain't shit8221;8221;
11610,3,0,3,0,1,I'm making a t-shi. It says Ke$ha, the white trash slut I wish I was.for teenage girls with shitty tasted in music.
11611,3,0,0,3,2,I'm making pollo a la brasso today
11612,3,0,3,0,1,I'm mattwho da boy hoe check me out I do some amazing shit
11613,3,0,3,0,1,I'm naturally bowlegged.. I be trying to stand normal . I think i look deformed while hoes thinking that shit is cute.
11614,3,1,2,0,1,I'm never gonna be ok with my nigga around alot of bitches while with his boys. Cause I was once that female your boys put you on !!
11615,3,0,3,0,1,I'm nice to everyone, but don't let this pretty smile confuse you, because i can turn to bitch in nanoseconds.
11616,3,0,3,0,1,I'm no man-hoe tho....
11617,6,0,6,0,1,I'm no pussy, but ur still a dick.
11618,3,0,3,0,1,I'm not BROKE 128080;128581;128078;128164; bitch I'm BLESSED 128588;128591;128591;128077;128077;128076;9996;65039;128175;
11619,3,0,2,1,1,I'm not a ho because I think two men and one woman together is a THREESOME and NOT a TRAIN. #getyamindright
1158,3,0,3,0,1,8220;@BeautiifulVixen: Bitches love throwing that irrelevant shade 9995;128553; go sit lil bitch .8221;128175;128175;128175;
11620,3,0,3,0,1,I'm not a ho like you. Your body count probably is close to 100
11621,3,0,0,3,2,I'm not big on the Uncle Tomslur anyway, but can we at least reserve it for those who earn it, not just those who dare to not vote Dem?
11622,3,0,3,0,1,I'm not bouta let no bitch play with none of my family. It don't matter if I fuck with them or not.
11623,3,0,3,0,1,I'm not dating anyone right now, I'm giving my pussy a brake.
11624,4,1,3,0,1,I'm not defending Ray Rice but that double standard is a bitch, ain't it http://t.co/PlKFb3LNEM
11625,3,0,3,0,1,I'm not down to be a side bitch tho 128075;
11626,3,0,0,3,2,I'm not from the ghetto.
11627,3,1,2,0,1,I'm not fuckin wit October She on some new shit , bitch cold
11628,3,0,3,0,1,I'm not going to chase a dumb bitch
11629,3,0,3,0,1,I'm not much of a texted get off my nuttz hoe
1159,3,0,0,3,2,8220;@BeautyOfASinner: So they really deleted flappy bird from the App Store cus someone killed themselves over it 128514;8221; foreal foreal ?? 128561;128557;
11630,3,0,3,0,1,I'm not paicularly shy, but hard for me to break ice with a stranger or in others words I'm a pussy 128517; haha she was so cute too!
11631,3,0,0,3,2,I'm not really a phone kinda guy.. I actually hate talking on the phone &amp; texting kinda trash to me also.
11633,3,0,3,0,1,I'm not the brightest but i can guess her game a lil and i know how much of attention whores those bitches are
11634,3,0,2,1,1,I'm not the type of guy to bitch about how hot it is but it's about to be 11 and I'm still sweating
11635,3,1,2,0,1,I'm not the type to fight no bitch over a nigga im the type to say fucc that &amp; take his Bitch 9995;128514;128527;
11636,3,3,0,0,0,I'm not weird, you're just a faggot
11637,3,2,1,0,0,I'm obviously not talking about CoD because that game is for queers.
11638,3,0,3,0,1,I'm off work, where the naked hoes and alcohol?
11639,3,0,2,1,1,I'm officially dubbing that nasty, un-natural shade of red that looks good on no one that you usually see in the ghetto hood red.
11640,3,0,0,3,2,I'm okay with rasor talking trash
1160,3,0,3,0,1,8220;@BeenSlimm: Too many lil niggason my TL. http://t.co/vqGezMMwWs8221; boosie got hoes
11641,3,0,3,0,1,I'm old but my pussy still poppin tho
11642,3,0,3,0,1,I'm old school I'll smack a bitch
11643,3,0,3,0,1,I'm on a boat bitch
11644,3,0,3,0,1,I'm on my fuck that bitch shit
11645,3,0,3,0,1,I'm on that good kush and alcohol.. I got some down bitches, but the can crawl
11646,3,0,3,0,1,I'm only driving drunk cause this bitch drove me to drink!
11647,3,0,3,0,1,I'm only on here cause my bitch tripping 128514;
11648,3,0,3,0,1,I'm organizing a cease fire between bald headed bitches and weave !
11649,3,0,3,0,1,I'm out @VandalSavage_: Slipping mollies in the Jell-O  @80sbaby4life: Cosby out here fucking bitches with pudding pops lmao
11650,3,0,3,0,1,I'm out this bitch
1161,9,1,8,0,1,8220;@Benkasso: I'll beat the pussy up, that's a hook right thur8221; 128064;
11651,3,0,3,0,1,I'm pissed off bitches on my dick but shit my dick soft
CAUSE THE WAY YOU CARRY YOURSELF GOT ME TICKED OFF I ain't tryin to be Rick Ross...
11652,3,0,3,0,1,I'm pretty sure I've never sat in the friend zone waiting for pussy. You gotta put your dick on the table and see what happens
11653,3,0,3,0,1,I'm pretty sure the dmv won't let me take a new pic, but a bitch might accidentally lose my license again where they have to take a new pic
11654,3,0,3,0,1,I'm pussy I'm not about this internet life 128557;128532;.
11655,3,0,3,0,1,I'm pussy whipping these hoes
11656,3,0,3,0,1,I'm ready to bounce out dis bitch -.-
11657,3,0,3,0,1,I'm ready to cry I'm so mad, like me &amp; this bitch gon have to fight.
11658,3,0,3,0,1,I'm really nice 128557; but a bitch at times
11659,3,0,3,0,1,I'm really not a complete bitch, just socially handicapped 128587;
11660,3,0,2,1,1,I'm retarded hungover and all we had were beers. A lot of beers.
1162,3,0,0,3,2,8220;@BestOfAds: Rape? Cannibalism? You Won't Recognize The Original Versions Of These Fairy Tales http://t.co/PrnJ8EFAoi8221; man wtf
11662,9,0,9,0,1,I'm rich bitch 
*said in Dave Chappell voice*
11663,3,0,3,0,1,I'm roasting the first one of my niccas who rock them shits!
11664,3,0,3,0,1,I'm saying though!! 128514;128514;128553;128553;  @___bria: all my panties be vs. ion look like these bitches tho
11665,3,2,1,0,0,I'm seeing more &amp; more niggers migrating fuher up libey rd... smh
11666,3,0,3,0,1,I'm serious bruh! She's too pretty I would eat both her pussy &amp; butt 128557;
11667,3,0,3,0,1,I'm seventeen years old with a government job, ask me if I give two fucks about the next bitch 128564;
11668,3,0,2,1,1,I'm sick and TIRED of #faggot #cages trying to see how long before #Moses kills a #Royal.................. #WorldSeries #barrybonds #jokes
11669,3,0,3,0,1,I'm sick and tired of the 'above the fray' crowd, 'they're all the same' crowd, the mushy moderate, the contrarian etc.Wake up pussies. #War
11670,3,0,3,0,1,I'm sick as fuck... this shit is for the birds
11671,3,1,2,0,1,I'm sick of dudes posting videos of them singing on vine. Do that shit in the shower or something fags
1163,3,0,2,1,1,8220;@BetterAreTulips: Jose ur mean :/8221; I said ily stfu hoe
11672,3,1,2,0,1,I'm sick of niggas lying. I'm sick of bitches hawking. Matter of fact, I'm sick of talking. RIP BIG http://t.co/WQ5YXWgHd9
11673,4,1,3,0,1,I'm sick of you hoes for real I got somebody that looks up to me so I ain't bout no pussy shit.
11674,3,0,3,0,1,I'm sick of you hoes oml
11675,3,0,3,0,1,I'm sippin on Patron nigga , my bitch bad to the bone nigga . She fucked up , I'm fucked up , she like how we gon get home nigga ? 
11676,3,0,3,0,1,I'm so excited to hang out with my bitches @CheralynVB @LaurieMcKinley
11677,3,0,3,0,1,I'm so faded my nigga I'm about to disappear in this bitch
11678,3,0,3,0,1,I'm so glad I don't wake up lookin like one those Medusa lookin bitches
11679,3,0,3,0,1,I'm so high high high that a bitch can't blow my high
11680,3,1,2,0,1,I'm so mad cause hoes think it's funny
11681,9,3,6,0,1,I'm so mother fucken sexy. I have no time to be a retard.
1164,3,0,3,0,1,8220;@BetterAreTulips: girls are fucking retarded my back staed cramping up man8221; it's the double d's
11682,3,0,2,1,1,I'm so raw is problem the best song tyga will have anything after that is trash
11683,3,3,0,0,0,I'm so sick of u niggers...
11684,3,0,3,0,1,I'm so tired of this damn job man, I wanna blow this bitch up lol
11685,3,0,3,0,1,I'm sorry but if your costume is a naughty school girlthis yr I will forever consider u a basic bitch. #becreative #followers
11686,3,0,3,0,1,I'm sorry but this makes me feel so free. Like a fucking majestic bird. #gotonelessproblemwithoutya http://t.co/EKFOVVcWht
11687,3,0,3,0,1,I'm sorry but why should I care about what bitch my nigga was fucking w before me
11688,3,0,3,0,1,I'm sorry.. I'm sorry.. I can't fuc wit u no mo hoe.. and I'm sorry 128514;
11689,3,0,3,0,1,I'm staing to act Hollywood round this bitch
11690,3,2,1,0,0,I'm staing to not like meek, this nig a lil to arrogant for me
11691,3,0,3,0,1,I'm sticking with @tha_fluzzy07's theory that black pussy tastes like strawberry milk.
115,3,0,3,0,1,@DoYou_Q: Got bitches in the DM but I don't ever read'emwhich is y your top 3
1165,3,0,2,1,1,8220;@BigMamaaTee: There's a difference between being actually crazy &amp; aspiring crazy8221; real shit . I can't stand fake crazybitches
11692,3,1,2,0,1,I'm still mad because this nigga really said I got bitches texting me asking me...Oh REALLY ? But let me say sum wit that in it 128175;
11693,3,0,3,0,1,I'm still weak off the bitch gettin pissed on lol
11694,3,0,3,0,1,I'm stuck in my room.. The house is shifting or whatever and it used to be just kind of a bitch to open my door but now it's like.. Stuck.
11695,6,0,6,0,1,I'm such a bitch sometimes lol
11696,3,0,3,0,1,I'm such a bitch to Austin 128514;128514;
11697,6,1,2,3,2,I'm such a retard sometimes.
11698,3,2,1,0,0,I'm sure @AFP would add this helpful parenthetical explanation if these were redneck peckerwood teabaggers. https://t.co/zkqg5WfE5R
11699,3,1,2,0,1,I'm surprised I'm still at school tbh, I can be quite the retard at times. I'm either exceptional at a subject or absolute shiteee.
11700,3,0,3,0,1,I'm talkin bout superb punching. The ref wAs on some hoe shit against Carlton Haywood. Dude took a full minute of unanswered @Royceda59
11702,3,0,3,0,1,I'm thankful for dem big booty hoes doe #realtalk
1166,3,0,3,0,1,8220;@BillieBoyMitch: @VSamone man I was bouta text all the bitches that ever told me that 128514;8221;lmao you should
11703,6,0,0,6,2,I'm the biggest redskins dam right now if they get this stop
11704,3,0,3,0,1,I'm the bitch that a come out n sweats n still have Ya nigga checking for me128526;
11705,3,0,3,0,1,I'm the crazy bitch that will call you 10 times in one hour
11706,6,0,6,0,1,I'm the gym looking at bitches booty #creeping 9996;65039;
11707,3,0,3,0,1,I'm the man around dis bitch baby
11708,3,0,3,0,1,I'm the pull bitch
11709,3,0,3,0,1,I'm the real Tony Montana, I got 50 naked bitches on a banana boat
11710,3,0,3,0,1,I'm the type of person who act like I don't care to ceain reactions but truly I'm a little bitch inside
11711,3,1,2,0,1,I'm thinking he has low level OCD of some so.... That or he's just goin full retard... Pretty sure full retard
11712,3,1,2,0,1,I'm tired of bitches thinking they cool when they ugly. If you're ugly bitch that's all you are is ugly
1167,3,2,1,0,0,8220;@BixxhMakeMeRich: If u ask me, every bitch gay8221;or bi
11713,3,0,3,0,1,I'm too much of a bitch to say anything about that
11714,3,0,2,1,1,I'm too nice to people , but when I finally decide to say something , I'm a bitch . wonderful .
11715,3,0,3,0,1,I'm tryna eat steaks n dis hoe wanna eat peanuts!! -- @BIRDMAN5STAR voice
11716,3,0,3,0,1,I'm tryna face fuck kesha, you bitches bringin beef I'll get the lettuce n ketchup
11717,3,0,3,0,1,I'm tryna turn M's to B's innis bitch and I ain't never paid to be wit no bitch!
11718,3,0,2,1,1,I'm turning into a healess bitch.
11719,3,0,3,0,1,I'm up and at it before the birds wake up so you can't tell me shit.
11720,3,0,3,0,1,I'm up bored denna bitch
11721,3,0,3,0,1,I'm up hoe
11722,3,0,3,0,1,I'm use to these hoes don't play
1168,3,0,2,1,1,8220;@Black_Angelo25: First time with 3. Lol http://t.co/mITmFPvVLw8221; yuhhhh we hit that hoe!!
11723,3,0,3,0,1,I'm with 3 bitches &amp; 2 of em mix
11724,6,1,5,0,1,I'm with another nigga bitch 128514;128514;
11725,3,0,3,0,1,I'm.a be even pretty 128129; julisa work magic on bitches .. Lol i keep stalking her IG to see how perfect I want my braids... Its hard to pick!!
11726,3,0,3,0,1,I'mma go with #6.

Cuz them Scream bitches STAYED getting knocked over an shit. Fuck them pussies. Without surprise they shitty.
11727,3,0,3,0,1,I've been sleeping with my mom for the past few weeks and I swear this bitch is having sex dreams or something always moaning in her sleep
11728,3,1,2,0,1,I've been tryin to tell niggas  @_nicarrag Lesbian porn have the finest bitches
11729,3,0,3,0,1,I've eaten six packs of hello kitty fruit snacks today because I can bitch I'm an adult.
11730,3,0,0,3,2,I've got a birds eye view of all the secrets you keep.
11731,3,1,2,0,1,I've got everybody Skuing these hoes 128514;128514;128514;128514;9995;
11732,3,0,0,3,2,I've got saltine crackers and red wine here. Is it possible to DIY a communion? I, uh, haven't been to church in awhile. #tbtweets
1169,3,1,2,0,1,8220;@BlizzyLC: @Vice504fly u need to be in someone's church negro!8221;ur absolutely right, but I work Sunday's but still no excuse.
11733,3,0,3,0,1,I've never felt this comfoable around a crazy in my life. Ole cool crazy ass bitch. This my nigga right here.
11734,3,0,0,3,2,I've never had a Twinkie.
11735,3,1,2,0,1,I've never had a problem w| anybody here, I've been w| the company for a year, and then this snitch fucking bitch is trying to get me fired
11736,3,0,0,3,2,I've pretty much eaten an entire box of my nephew's cheese nips. I only feel bad a little.
11737,3,0,0,3,2,I've seen #MajorLeauge with Charlie Sheen...........and the #Giants committed sin when they worshipped #barrybonds as a batting coach&gt;
11738,3,0,3,0,1,I've seen every episode of scrubs ever. Sense the first episode niggah!!
11739,3,0,3,0,1,I've told those bitches at the dentist about my gums receding for the past fuckin year and now they wanna warn me about it
11740,3,1,2,0,1,I, I see some hoes in hurrrr
11741,3,0,0,3,2,I, for one, welcome our new Eastern Panhandle overlords, and hope they do a better job than the yokels who got us here in the first place.
11742,3,0,3,0,1,IG be the bid bitches an these dumb ass faces lol
1170,3,0,3,0,1,8220;@BlizzyLC: Police just tried to Rodney King a nigga...8221;happen to my nig out here
11743,3,0,2,1,1,IM our here filling these hoes jaw side
11744,3,0,1,2,2,ISIS Jihadis Discuss 8216;Buying And Selling8217; Yezidi Girls As Slaves http://t.co/UoPgIPOpWS #tcot #pjnet
11745,3,0,0,3,2,ISIS Jihadis In Australia Shoot Man In The Face, Chanting 8216;ISIS Will Stay8217; http://t.co/xyzXv5LZs1 #tcot #pjnet
11746,3,0,0,3,2,ISIS Suppoers in America: The Jihadis Next Door http://t.co/u0YHWkD34c http://t.co/0XHPbRL9EQ
11747,3,0,3,0,1,Ian watch Maury in so long ..Maury wear jeans on the show now.. I guess he like f**k I need to dress up for these ghetto ass ppl anymore
11748,3,0,3,0,1,Ibuki180;s shaved pussy fingered and fucked before her tight little rosebud of an ass is160;destroyed http://t.co/kPxRSZVD9K
11749,3,0,3,0,1,Id light that bitch on fire staing with that ratchet ass weave
11750,3,0,3,0,1,Id make you look like an absolute pussy, because you're too scared to say anything to my face hahahahahaha
11751,6,2,3,1,1,Id rather be your niggah
11752,3,0,3,0,1,Idc I eat the pussy 128513;
1171,3,0,3,0,1,8220;@BlueEyeBeaner: Vienna sausage clit http://t.co/YY1Gj6oeds8221; 

