13690,3,2,1,0,0,Niggas/bitches cheat cause mf's always think they gettin played
13691,3,1,2,0,1,Niggaz been making trash lately. Well not everybody but some lol
13693,3,0,3,0,1,Niggaz irrational these days...Quick to jump bad bout a bitch...
13694,3,0,3,0,1,Niggaz retweet bitch ass niggaz but won't retweet a real nigga
13696,6,0,5,1,1,Night bitches. 9996;
13697,3,1,2,0,1,Night niggers
13698,3,0,0,3,2,Nike DC is trash.
13699,3,0,3,0,1,Nikki Minaj is proof that natural is better ! Minimal is best ! Some of y'all hoes be overdoing it
1366,3,0,3,0,1,8220;@Jaydillz: The day you unblock me you will become a man again. But that won't happen so you just a bitch.8221; @iDisrespectHoez lol
13700,9,2,7,0,1,Nikko a gay bitch
13701,3,0,3,0,1,Nile...  @JosephBananas I'm really sad that I don't have enough friends to ever be called a pack of niggerswith. That's my fuckin dream
13702,3,0,2,1,1,Nino Brown? Oh das me  @erikacarissa Nino Brown on yall hoes.
13703,3,0,3,0,1,Nippin these Clarke Motel bitches...they get free pizza EVERY DAY and don't tip shit. Also never give us any business. Game is over.
13704,3,0,1,2,2,Nipple banana monkey!
13705,3,1,2,0,1,No I don't love these hoes and FUCK these niggas Fuckem
13706,6,0,5,1,1,No bitch, I don?t have anything to hide. I just don?t like people looking through my phone..
13707,3,1,2,0,1,No bitch. You slut.  @ITSBEEBITCH__: @viaNAWF CHILL
13708,3,0,1,2,2,No cuz redskins are dumpster juice  @trackinBlackKev: game of the week. still the best rivalry in spos
13709,3,0,3,0,1,No face no trace pussy boys #SNATCH
1367,3,0,3,0,1,8220;@JennaHord12: @ambernicolee05 dreamgirl McKee 128514;8221;Ooh! Bet you wooonnnttt stick dat hoe
13710,3,0,3,0,1,No fucks given about the NFL draft it's baseball season bitch
13711,3,0,1,2,2,No girls no hoes just me myself and I
13712,4,3,1,0,0,No half-breed spic has any right to say anything to any Anglo ever, and should be killed for doing so.
13713,3,0,3,0,1,No hoe shit tho I was bout to say Perro got butt naked bitches doing dishes
13714,3,0,3,0,1,No i dont own the pussy i just sample it!!
13715,3,0,3,0,1,No less than 3 bad bitches in my bed at a time...
13716,3,0,3,0,1,No matter how hard you try to be rude mf`s they keep talking to you. like bitch do I know you
13717,3,0,3,0,1,No more SnapChat Selfies. No more Instagram Selfies. No more NOTHING i WILL NOT be a bad bitch a week man what am I going to do 128546;128299;
13718,3,0,3,0,1,No more hoes n oz
13719,3,0,0,3,2,No more speculation. No more mock drafts. It's finally Draft Day. #BolesKombat #StormWarning #BuiltByUCF #ChargeOn
1368,3,0,3,0,1,8220;@JennerAcosta: Sleep over with guys doesn't mean we gonna fuck. TRUST ME8221; you're a bitch for denying them pussy
13720,6,0,6,0,1,No need to tweet these bitches know my status
13721,3,0,3,0,1,No nigga a leave a chick with some good pussy unless he just paper chasin
13722,3,0,3,0,1,No officer I wasn't drunk driving, I was swerving on them hoes.
13723,3,0,3,0,1,No one can take your woman. They can only take your hoe.
13725,3,2,0,1,0,No one goes into psychiatry to help people. Those people are all immoral. Everyone who works in that field is pure trash.
13726,3,0,0,3,2,No one has even eaten a Twinkie in, like, decades.
13727,3,0,2,1,1,No one understands how much it pisses me off when people use the word retard.
13728,3,2,1,0,0,No police depament that hires gypsies, half-breeds, and nigglets should be trusted.
13729,3,0,3,0,1,No saving hoes
13730,3,0,3,0,1,No sex bitch I only want the neck bitch
135,3,0,3,0,1,@Goofstroop: You a woulda coulda shoulda ass hoe 128563;128586;
1369,3,0,3,0,1,8220;@JerGucci: @1__dev You the Real MVP8221; that's wat ya bitch said when I finished 128514;
13731,3,0,3,0,1,No skimp shit here bitch
13732,3,0,2,1,1,No sleep, sleep is for pussies.
13733,3,0,3,0,1,No summer school? 128515;128515;128515;128515;128515;128515;128515;128515;128515;128515;128515;128515;128515;128515;128515;128515;128515;128515;128515;128515;128515;128515;128515;128515;128515;128515;128515;128515;128515;128515;128515;128515;128515;128515;128515;128515;128515;128515;128515;128515;128515;128515;128515;128515;128515;128515;128515;128515;128515;128515;128515;128515;128515;128515;128515;128515;128515;128515;128515;128515;128515;128515;128515;128515;128515; eat a dick school. Im done with your bitch ass !!!!!!
13734,3,1,2,0,1,No thanks lady, you look like you just got off the white trash train, I'd rather not catch a disease. #kthxbai
13735,3,2,1,0,0,No these are only whites pies.
Well do you have any negro pies?
13736,3,0,3,0,1,No this bitch @Cee_Murda94 did not yell down the steps to tell me don't eat her damn chicken.128514;128514; tf
13737,3,0,3,0,1,No this little hood bitch did NOT just try to take me to task for JOKING with my niece about not being a Lesbian. Ch! &gt;_&gt;
13738,3,0,3,0,1,No time for bitch niggas.
13739,3,0,2,1,1,No time for chasing after someone is like turning up off wine coolers, you look like a bitch when you really think about it lol
13740,3,0,3,0,1,No way all u niggers are employees of the month
1370,3,0,3,0,1,8220;@JestonaeLives: Burnt pussy lips - 128514;128514;128514; https://t.co/1WhgfzBUkR8221; gal in the blue throwing it 128527;
13741,3,1,2,0,1,No wealth doesn't insulate from being called nigger. But still does improve empirical quality of life outcomes, phenomenally. @Dwight_Dale
13742,3,0,3,0,1,No wonder these ppl that call themselves niggas &amp; thugs able to convince their hoes false ideas about men like me in our intellectual dress
13743,3,0,3,0,1,No. A dog like that needs bitches and he ain't ever gonna get bitches with that on him 128530;128548;
13744,3,2,1,0,0,No. Its wrong to try to change #faggots&gt; There is no therapyso #tcot should understand and sympathize like they are #retards&gt;
13745,3,0,3,0,1,No. She's gonna sit tf down &amp; text her hoes.She's not gonna care about what you're doing.
13746,3,0,1,2,2,Noap. Not taking them.  @TiffNCompany: Maca root pills making my vagina do the wop
13747,3,1,2,0,1,Nobody cares you fucking fag damn you bring bitches water even though youre thirsty as fuck 128514;128514;128514; #fucknigga
13748,3,0,3,0,1,Nobody ever got famous by being a whiny bitch. Either change the things that make you unhappy, or be a whining turd-farmer.
13749,3,0,0,3,2,Nobody gives me a trophy cause I'm old and colored #FavStaweets160;
13750,3,0,3,0,1,Nobody is going to say anything about how unloyal Sterling's side bitch is?
1371,6,0,6,0,1,8220;@JoeBudden: The bad bitches are only bad until they sta talking anyway.8221; He Preaching
13751,3,0,3,0,1,Nobody on planet Eah more protective than bull dykes
13752,3,0,3,0,1,Nobody should ever have sex with a diy dick or pussy. That says a lot about you if you fuck em knowing they smell like chitlings
13753,3,0,3,0,1,Nobody wit me im on all alone shit so dont think im actin funny when im in my zone bitch
13754,3,0,3,0,1,None of my bitches can stay over
13755,3,2,1,0,0,None of us went to these PRESTIGIOUS establishments so we're clearly not as superior as these fucking retards...
13756,6,0,5,1,1,Nooo.. not Sailor Moon and squad in the club w/ all my bitches lookin good.https://t.co/S6Yj748if1
13757,6,0,0,6,2,Nope! It's just yellow OTL
13758,3,0,3,0,1,Norbit mad as a bitch lmfaooooooo 128514;128514;
13759,3,0,0,3,2,Norwalk ghetto af lol all of a sudden everyone a dodger and raider fan
13760,3,0,0,3,2,Nose goes on taking out the trash this time. 128586; @caitnicole3 @CiCi_Phi
1372,3,0,0,3,2,8220;@JohnelHadleyJr: Uncle Charlie just got thru lip singing?!8221;haha
13761,3,0,2,1,1,Not us bitches128514;128514;128514;128514;128514;
13762,3,0,3,0,1,Not 1 bit of couesy from any of these bainbridge isl. ferry riders... Fuck em next time I think s gonna break downpaybacks a bitch
13763,3,0,3,0,1,Not ALL females constantly tweet about their boyfriends but I wish death on the ones that do. TIRED of you AND him, bitch
13764,3,2,1,0,0,Not All Straight Men - I am frustrated. Unlike on OKCupid, queer folks don8217;t have the ability to block... http://t.co/hBF2xZa0ke
13765,3,0,3,0,1,Not a cloud in sight, too pretty to ho to work. #iwanttoplay
13766,3,1,2,0,1,Not a fan of her... guess im the minority. @KfromtheG: Beyonc233; ratchet ass is trash  @Vagitarian__: you're the anti christ. KfromtheG
13767,3,0,2,1,1,Not a neanudda bitch @CONSTANTINE_D_
13768,3,0,1,2,2,Not a word on Jihadi stream about the Kurdish female suicide bomber in Kobane. That story undermines their mythology on several levels.
13769,3,0,3,0,1,Not about to play these games with this bitch
13770,3,0,1,2,2,Not allowed to play flappy bird around grandma because she swears at me to stop swearing lol
1373,3,0,0,3,2,8220;@JuanNdaCut: When twitter rappers dm me their trash links http://t.co/o5Orzo1O198221;
13771,3,1,2,0,1,Not associate but ya nicca
13772,3,1,2,0,1,Not eating pussy is un-American.
13773,3,0,3,0,1,Not even 20 and I've already smoked out 2 countries bitch. I do what the fuck I want.
13774,3,0,3,0,1,Not even sweating these hoes 128524;128588;
13775,3,0,3,0,1,Not every girl likes a sweet ass emoji ass nigguh. Some girls like a you sexy afass nigguh
13776,3,0,3,0,1,Not finna play with the bitches lmao
13777,3,1,2,0,1,Not going to put up a red equals sign on my Facebook because I'm not a faggot, but I'm all for marriage equality #prop8
13778,6,1,3,2,1,Not just exist, but contribute. And contribute to things they themselves enjoy. That often it's a queer person behind those products.
13779,3,1,2,0,1,Not my fault yo bitch wanna flip me
13780,3,0,2,1,1,Not one bitch is texting me right now. 3,000 followers, 22 inch rims, 60 inch tv and straight ass teeth but 0 text messages. Ima kill myself
1374,3,0,1,2,2,8220;@JukeJuke_9: Lance Stevenson gone leave Indiana8221; he trash anyway
13781,6,2,3,1,1,Not protected in the state of Utah. There is no fear of queer couples forcing churches to marry them. They do not legally have to do so.
13782,3,1,0,2,2,Not really sure how to describe what's happening here #eurotrash @mguiducci @nickbrown85 @ VIP Room http://t.co/WTS6nM3egc
13783,3,0,0,3,2,Not sure why #teabaggers would care about Nelson Mandela, being that he's one of 'them' if you know what I mean. #teapay #tcot
13784,3,0,3,0,1,Not sure why someone would put my pictures on a esco website I ain't selling pussy
13785,3,0,0,3,2,Not that I plan on dying soon, but I'm totally going to write Kenobi in as my sole heir. He's the only thing locally (under 94) I can trust
13786,3,0,3,0,1,Not the type to take it slow, turn a good girl into a hoe. #spookyblack
13787,3,0,3,0,1,Not to call you a bitch ... But they gone hate on my bitches
13788,3,0,2,1,1,Not to sound like a total bitch but I'm tired of peoples kids and the back to school pics128530; we ain't post pics on the back to college day
13789,3,0,3,0,1,Not trash, just plain as fuck for $225. And come on, no elephant print on a 3?
13790,3,0,3,0,1,Not true  @_Kimchanel_: Every man has hoes #bye
1375,3,1,2,0,1,8220;@JulianSantomaur: 50 with 30 hoes on my dick #sweg8221; you have learned from the best
13791,3,2,0,1,0,Not trying to follow any spooks, no offense ...
13792,3,0,0,3,2,Not ya grandma brownies, wink wink http://t.co/pZPI8RUQ4F
13793,3,0,0,3,2,Note the rocketeer removes cardboard from launcher and carries it to a trash bin before fleeing.
#TidyTerrorist

http://t.co/sb3U1XpeG4
13794,3,0,0,3,2,Note: Khorasan is the old Arabic name for pas of Iran, Afghanistan. Not an invention of modern Jihadis. #justsayin
13795,3,0,1,2,2,Nothing good on TV and the @Yankees are eating their balls 3 innings in. Great.
13796,3,0,3,0,1,Nothing is too spicy. And if it is,
1) stop being a fucking bitch
2) eat more of it
3) cry you fucking pussy
13797,3,0,0,3,2,Nothing more yokel MSU fan than to constantly reassess Izzo *aka our only consistent winner since D. Daughey or Biggie flipping Munn*
13798,3,0,1,2,2,Nothing says teabagger like a millionaire complaining that they are broke, huh #HillaryClinton? #Hillary2016, give me a break, lol. #p2
13799,3,0,3,0,1,Nothing worse than a baby bitch pussy. Go fly a kite
13800,3,0,3,0,1,Notice I didn't tweet bytches.... Bytch is different from bitch.... My logic... And it WERKS...
1376,3,0,0,3,2,8220;@JuniorMaye8: A lot of them are though. Attitudes be pure trash8221;

#TeamWhiteGirls 
#SwirlTheWorld
13801,3,1,2,0,1,Notice I don't make music for niggas that don't get pussy.-Drake
#LordKnows
13802,3,0,0,3,2,Now I am seeing chatter among Jihadi fans taking credit for an alledged kidnapping of a Frenchman in #Algeria #France
13803,3,0,3,0,1,Now I could say my name butttttt, ya bitch already knows it 127926;
13804,3,0,3,0,1,Now I don't even want to do anything. Son of a bitch
13805,3,0,3,0,1,Now I seperate from niggas I don't trust niggas that ain't starve wit me and all the bitches I didn't fuc !
13806,3,0,0,3,2,Now I'm gook boy shawty http://t.co/LAAaHsTYeB
13807,3,0,0,3,2,Now I'm listening to lil spook getting the good kinda sad Imma be single this fall I know you'll getting annoyed with me on your TL but aye
13808,3,0,3,0,1,Now UNFOLLOWING !!! Lol 8220;@rikababey: My pussy been turned off lately.. I won't be fucking no time soon. Forever dry8221;
13809,3,1,2,0,1,Now a days niqqas would rather be real wit a niqqa or bitch they wanna fuck wit rather than they day one niqqa smfh our generation is fallin
13810,3,0,3,0,1,Now a days, hoes be twerkin for new weave.
1377,3,0,3,0,1,8220;@JustKarahn: 8220;@what_iDO: Sit in there and shit dnt sing hoe @JustKarahn8221;. no8221;yess
13811,6,0,5,1,1,Now a neighborhood nigga like me ain't supposed to get no pussy like this
13812,3,0,2,1,1,Now all the hoes bout to post the saints lost but im still cutepics on the gram 128514;128514;128514;
13813,3,0,3,0,1,Now da #Heat fans bacc y'all niccas kill me ain't tweeted shit all damn game
13814,3,0,3,0,1,Now don't you hate them ol... Lyin ass hoes... Smilin in ya face wearin her best friends clothes
13815,3,0,0,3,2,Now infuriated Jihadis are putting out murder requests on #Saudi fighter pilots who paicipated in the bombings in #Syria #ISIS
13816,6,1,5,0,1,Now my side bitch my main bitch Bc my main hoe ain't feeling me no mo. No mo.
13817,3,0,3,0,1,Now my side bitch my main bitch cause my main bitch aint feelin me no moe
13818,3,0,2,1,1,Now niccas won't haircuts
13819,3,0,3,0,1,Now put Ya ass on this dicc, let me know you that baddest lit bitch.
13821,4,0,4,0,1,Now that nicki minaj said fuck skinny bitcheswatch all these fat bitches come outta no where it's time to play.
1378,3,0,2,1,1,8220;@JustKarahn: 8220;@what_iDO: Y though http://t.co/hg6OO3X3o68221; really hoe? really?8221; U the dummy taking a pic
13822,3,0,3,0,1,Now that's how you let the beat build bitch .. Thats my ish  @ImSoSouthern706: As I hit the kill switch.....
13823,3,0,3,0,1,Now the bitch tryin to do vids too? Gurl sit cho ass down
13824,3,0,3,0,1,Now they cheating bitch yall defense SAD as the fuck!!!!!  @rickey0511: They about to cheat
13825,3,0,3,0,1,Now this new bitch acting dumb tryna correct my every word.
13826,3,0,3,0,1,Now when I put this pussy on Vivian she bet not be playing 128514;128557;128527;
13827,3,0,3,0,1,Now you're drinking till you're unconscious. Feel me when you get a fine bitch.
13828,3,0,0,3,2,Now, the Jihadi networks waking up &amp; claiming #Raqqa radio 8220;confirmed8221; two planes shot down &amp; 1 pilot captured. #ISIS #Syria
13829,3,0,3,0,1,Nower days the defenition of a bad bitch is how good her pussy is ?
13830,3,1,2,0,1,Nuggas be to obsessed with the homies. Like the cant bag bitches
13831,3,0,3,0,1,Nuh uh  @MissSneed: still counts.  @WeavusChrist: I8217;m only a hoe on twitter, bae
136,3,0,3,0,1,@Gotti_LTF: Happy Bday Bitch Ass Nigga @JetsAndASwisherpreciate that bitch roll up!
1379,3,0,3,0,1,8220;@KINSL3Y: When I'm in that pussy, honey I'm home!8221; 128514;128514;128514;
13832,3,0,3,0,1,Nuke town that pussy
13833,3,0,3,0,1,Nyomi Banxxx and Skin Diamond the last of the good ebony porn bitches.
13835,6,0,6,0,1,OG old faced hunnids with a young hoe
13836,3,0,3,0,1,OGs Love too See a yung nicca come up
13837,3,0,0,3,2,OH NO @morningmika are you saying the Democrats lost the #teabagger vote? LMAO bobble head #morningjoe
13838,3,1,2,0,1,OHH&gt; #whine #whine #whine says my #faggot #ass #steroid CREAM FORGIVING #Giants&gt; Is #busterposey takin' shot from #barrybonds? Is that it?
13839,3,0,3,0,1,OKC nigguh
13840,3,0,3,0,1,OMG , I'm high as a bitch ! 128514;
13841,3,2,1,0,0,OMG @FrannyHilIson: @pattiemallette ugly faggot. Your a bad mother. You should kill yourself like Robin Williams
13842,3,0,3,0,1,OMG  @Master_Bay: Have yall ever met a dyke who didn't have a kid?
1380,6,0,6,0,1,8220;@KaayGQ: Sexy bitch, hope she bout it8221;
13843,3,0,3,0,1,OMG  @beigegawdd: Nothing in life has made me softer than Fuck me with your nigger dick
13844,3,0,3,0,1,OMG  @shuggajets: 8220;@iAintAsianTho: when yo side bitch find the gift you bought for ya girl http://t.co/InzEzV9a1n8221; LMFAOOOOOOOO
13845,3,0,2,1,1,OMG This bitch on the Tico wont STFU ALREADy!!!!
13846,3,0,3,0,1,OMG&gt; I was throwing beer bottles on street and yelling at drunk homeless people to stop harassing the trannies.... #Game6 #tourebaseball
13847,3,1,2,0,1,OMGGGGG...!!!! Nigga said Jerry ... black bitch.
13848,3,1,2,0,1,ON. SIGHT!!  @MichyDoe: Bitch I bet not see you in the streets @CoreyWhiteJr3 trash ass nigga
13849,3,1,2,0,1,OT nicca word to the nigga who played jesus
13850,3,0,0,3,2,Obama mocked the special Olympics Wendy Davis mocks the handicapped do ya see a pattern? Democrats #tcot #UniteBlue
13851,3,1,0,2,2,Obama8217;s Newly Released Gitmo Jihadi Has Links To Terrorists In Syria http://t.co/MywaAFD1yB #tcot #pjnet
13852,3,2,0,1,0,Obama8217;s faves: Muslims, black ghetto trash http://t.co/qTfjRAijwn via @worldnetdaily
1381,3,0,1,2,2,8220;@KarynHalpin: Where do all the foreskins go when they circumcise a guy?8221; the Foreskin Fairy takes them after you put them under your pillow
13853,6,1,0,5,2,Obama's Hellfire missiles tend to vaporize Jihadis @BemetOr8 @PureMonotheist #UniteBlue
13854,4,0,4,0,1,Ocean drive 127754; then I gave it a pill I think @justmoody_: I met that pussy on ocean drive,8221;
13855,3,0,1,2,2,Och hoe wonderbaarlijk dat Jan het alweer met n Marokkaanse BNer aan de stok heeft. Na Fatima, Lamyea, Tofik, nu ook Abdelka te min gevonden
13856,3,0,3,0,1,Of all the lazy bitches, I was the laziest today #noregrets
13857,3,2,1,0,0,Of course my #faith for #baseball is off this year. BECAUSE OF #BARRYBONDS you goddamn retards!!!!!!!!!!!!!!!!!!!!!!!!!!!!!!!!!!! #morons
13858,3,0,3,0,1,Of course not. That means it's fajita time.  @CorporateBarbie If I'm flat ironing? Oh, bitch. We ain't never leaving.
13859,3,0,3,0,1,Off a lot of dope bitch I be high af
13861,3,0,1,2,2,Offensive line is trash
13862,3,0,3,0,1,Offensively, Joe Johnson just as good as LeBron. If not better. Don't @ me pussies
13863,3,0,0,3,2,Officials: Jihadi Cockroaches Now Booking Tickets On Cruise Ships To Syria http://t.co/hWKfMe75kx http://t.co/rLTlVYGpTl
1382,3,0,3,0,1,8220;@Kash_Stackz: Yall are so confused these days. http://t.co/l2ipE6UvQh8221; somebody put that hoe in a dress
13864,3,0,3,0,1,Oh @SoNi99a_: i hope Dre falls dickhole first into my pussy 
13865,3,0,0,3,2,Oh I forgot we lived in the ghetto....#hoodrats
13866,3,0,3,0,1,Oh I'm back now 2nd vap don't fuck with this one bitches http://t.co/f0TPxSUPKX
13867,3,0,3,0,1,Oh I'm nasty for smoking cigarettes? And you're nasty for not washing behind your ears everyday stupid little bitch
13868,3,0,0,3,2,Oh Yahweh, your hand is upon me, your shadow hovers over me.For your sake, The House of Ysrah'al mock me all day long http://t.co/wXEs0DQRP9
13869,3,0,3,0,1,Oh bitch you lurkin !? Well bitch I'm TWERKIN 128514;128588;
13870,3,0,3,0,1,Oh hell yeah! Lol  @SedSince81: @VonshayeB you know that nicca injury prone
13871,3,0,3,0,1,Oh it was multiple DNA on ol girl man they ran a train on that hoe 128514;128514;128514;
13872,3,1,0,2,2,Oh it's coon bike week in Charlotte ok makes sense now
13873,3,1,2,0,1,Oh look, Cutler didn't step into his throw and threw an int. Nice flat footed throw cunt.
1383,3,0,2,1,1,8220;@KateFrancesss: a majority of my news feed is people arguing about what it means to be a redneck #vermontproblems8221;
13874,3,0,0,3,2,Oh man. This could be a serious first ever Chanel bag contender  @evachen212 grape-colored Chanel bags http://t.co/q8ShjIFv
13875,3,0,3,0,1,Oh my god oh my god.. I'm going to a bitch mob pay today oh my god
13876,6,0,6,0,1,Oh my god this bitch walked past me and legit smelled like a fish market!! TFEH TFEH TFEH128562;
13877,3,0,0,3,2,Oh my. There was an Oreo baked into that chocolate chip cookie. #surprise
13878,3,0,2,1,1,Oh nah bitch .. I work too much to even think about it. Lol
13879,3,0,3,0,1,Oh no she didnt 128129; 8220;@NoBeeetch: Watch yo mouth bitch @BadMatatan: One bitch and two dogs http://t.co/TB06NYGmcV8221;
13880,3,0,3,0,1,Oh no tht hoe ode fake !!!
13881,3,0,3,0,1,Oh no. 8220;@ThaChicagoBull: It's Friday night, the night all the bitches cheat.8221;
13882,3,1,2,0,1,Oh please. You're a pussy
13883,3,0,3,0,1,Oh she is  @soARiE1017: @viaNAWF I respect that because bitches can be spiteful when it come to children
1384,3,0,3,0,1,8220;@KattWilliams: You can be a hoe without having sex, ask any of the girls texting alotta niggas at the same time.8221;
13884,3,0,2,1,1,Oh shit its still light out.. I've been in this bitch too long 128565;
13885,3,1,2,0,1,Oh shit! 128557;128128;  @ImDatNigga_Jack: 8220;@Sherman_King: Dallas trash.8221; Your hairline is trash
13886,3,1,0,2,2,Oh snap I'm just realizing this skinny tranny is Jared Leto. He's Wo unrecognizable with all that weight loss. Geez!!!
13887,3,0,3,0,1,Oh so now BC we didn't cover u bitches wanna talk shit??
13888,3,1,2,0,1,Oh well, you lil stupid ass bitch I don't fuck with Youuuuuu  @HoldMyPurseGirl: Idfwu is a bitter ass song and only fuck niggas like it.
13889,3,1,2,0,1,Oh yeah! Especially Winston niccas lmao  @LolaHas_ARRIVED: @VonshayeB @SpaceJam_Teeg think I wont lol. These 336 niggas
13890,3,0,3,0,1,Oh you got a new bitch you think you got a new bitch ...
13891,3,0,3,0,1,Oh you one of those stuck up bitches 128514;
13892,3,0,2,1,1,Oh you want pho? Well saimigi is ghetto pho, eat that shit since im broke128564;128514;
13893,3,0,1,2,2,Oh your gonna ruining your life just throwing it away smoking weed, but my test scores are higher than yours. . . . Just trash my life
1385,3,0,3,0,1,8220;@KayciMalynn: I'm a pro at losing followers. Some people just can't handle my excessive use of the work cunt.8221; Mines cause I say fuck
13894,3,0,3,0,1,Oh, and I'm back, bitch. No one walks all over me ever again. Ever.
13895,3,0,3,0,1,Oh, bitch!!! #Scandal
13896,3,0,3,0,1,Oh, no. Not Whitney! It can't b true! &gt;sob, sob, weep, sob&lt; Oh, the crack industry has lost their champion! #RIPWhitney, ya dumb bitch.
13897,3,0,2,1,1,Oh. Wow. Avoiding that bitch.
13898,4,0,4,0,1,Ohh &amp; btw @Leslieeeixta when you get a call from 24 blame @KimberlyyAye , bitch keeps signing up people bc she wants gym buddies lol
13899,3,0,2,1,1,Ohh my gawdd i woke up so throwed dis nicca paper slept n my damn car n he threw up n my Shit n i lost my phone smh GM
13900,6,0,6,0,1,Ohkay ma Texas bitch keep textin me , callin cryin stressin me bout where I been but I've been with another bitch allegedly 128076;
13901,3,0,3,0,1,Ohmygod please don't be a bitch to me today.
13902,3,0,3,0,1,Oi look at this pussy on your bed @PazzSince95 http://t.co/celrcwZiq3
13903,3,0,0,3,2,Ok so not all the shows on Caoon Network are complete trash. Stevm Universe is awwwwwesomeeeeee
1386,3,0,3,0,1,8220;@KeAuraM: 8220;@whitegoddesss: Repost . http://t.co/GCSrbhqoQP8221;128079;128079;128079;8221; kush blunt convos?? A simple minded ho made this pic I bet
13904,6,0,4,2,1,Ok this is funny... A proud liberal who wants to end racism calls Tim Scott an Uncle Tom Lolz lib idiots #tcot http://t.co/y6X6eagw20
13905,6,0,6,0,1,Ok, night night bitches
13906,3,2,1,0,0,Ok. Did this bitch just say wut I think she.said? I believe u just described urself dumbass
13907,3,0,2,1,1,Ok... sucking dick isn't supposed to be done in a cute Manor at all. Just like eating pussy you're not supposed to be scared of it.
13908,3,0,3,0,1,Okay I'm gonna need for everyone to stop calling Rihanna a hoe , k thanks .
13909,3,0,3,0,1,Okay ajay got one more time to call me a bitch in one of his lit sub tweets. Like bitch I will fucc yo lit life you got going UP !
13910,3,0,2,1,1,Okay but your number ain't been saved for how long ? 128533; Okay Thancc You 9995;128514; tf hoe.
13911,3,0,3,0,1,Okay don't reply then I didn't want you to anyways bitch
13912,6,1,5,0,1,Okay so I know I'm like ten years late but I freaking HATE Ana Sofia from Lost fuck that dumb bitch wtf is her problem 128545;128545;128545;128545;128545;128545;128545;128545;128545;128545;128545;
13913,3,1,2,0,1,Okay so either @ScubaKitteh is a super dyke or has some weird car sex fetish.
1387,3,0,3,0,1,8220;@Kevhoeee916: If I couldn't trust some of the homies how could I trust these hoes?8221;you can't lol
13914,3,0,3,0,1,Okay!  @_ProfessorX: Right8212; bitch!!!  @Mndspeak88: you mad cause YOU opened your mouth? #GreysAnatomy
13915,3,0,3,0,1,Okay, kids. #RickAndMoy just came on. That's how I know I'm tweeting WAY TOO LATE on a #Sunday night. #booya #bitches&gt; I'm outta here&gt;
13916,3,0,1,2,2,Okay, so maybe not every in #LosAngeles is evil. But I would 80% of the people I've encountered have been trash, another 10% barely human.
13917,3,1,2,0,1,Okay. Here. IF #natitude is SOOOOO COOL&gt; How come you bitches don't call Obama by BO JINGO? That's what I thought. #gobuycomb
13918,3,0,3,0,1,Okay. I'll stop being a bitch now... Maybe 128514;
13919,3,0,2,1,1,Oklahoma has 250 more yards than TU and is only up 4 points? trashhhhhhhh ass teams big xii trash
13920,3,0,3,0,1,Ol bitch ass look like she got a bobble head. @lilshwenda
13921,3,1,2,0,1,Ol heads always think a young nicca gon runoff wit they sacc
